{
  "$schema": "./outlets.schema.json",
  "__meta__": {
    "generated": "2026-10-03",
    "outlets_count": 9,
    "styleDefaults_fields": 6,
    "description": "Single source of truth for outlet definitions. Consumers must assert outlets_count == Object.keys(outlets).length."
  },
  "defaultOutlet": "TechPolicyPress",
  "styleDefaults": {
    "audience": "persuade a broad, non-specialist public to act",
    "readingLevel": "write for a general newspaper audience at roughly a 10th-grade reading level (Flesch-Kincaid grade ~10, and no higher than 11). This is the single most important constraint. If a passage would make a smart non-specialist reread it, simplify it.",
    "sentenceMechanics": "average under 18 words per sentence; NO sentence over 30 words. One idea per sentence. When a sentence carries two or three claims, split it into two or three sentences. Long, clause-chained sentences are the main reason these essays read as hard.",
    "paragraphMechanics": "at most four sentences AND at most ~90 words per paragraph. The word cap matters as much as the sentence count, four long sentences is still a wall. Break a longer paragraph in two.",
    "jargonGuidance": "Eliminate jargon and specialized acronyms. Translate every technical term into plain language without losing its meaning (e.g., \"new governmental restrictions,\" not \"legislative encroachment\"; \"federal engineers,\" not \"USACE\"). If a term is not universally understood by a general reader, replace it. Avoid abstract-noun pileups (\"sociotechnical complexity reduced to a frictionless slogan\"); say it plainly.",
    "bodyFormat": "No section labels or headers inside the body — it must read as continuous prose. Do NOT repeat the headline inside the body.",
    "readability": {
      "fkMax": 11,
      "maxSentWords": 30,
      "maxParaWords": 90
    }
  },
  "outlets": {
    "WashingtonPost": {
      "words": 800,
      "guidance": "The Washington Post: max 800 words, strong news hook, hyperlink-able sources, zero jargon; national public audience."
    },
    "NYTimes": {
      "words": 800,
      "guidance": "The New York Times Guest Essay: ~800 words, sharp thesis, general national readership."
    },
    "WallStreetJournal": {
      "words": 900,
      "guidance": "The Wall Street Journal: 600-1200 words, rapid thesis, business/policy relevance, market and regulatory framing, zero jargon; executives, investors, policymakers."
    },
    "USAToday": {
      "words": 650,
      "guidance": "USA Today: 550-750 words, embed verifiable source references, plain and direct; broad national audience."
    },
    "ForeignAffairs": {
      "words": 1200,
      "guidance": "Foreign Affairs / policy platform: 800-1500 words, deeper structural analysis permitted; subject specialists, Hill staff, agency officials."
    },
    "Politico": {
      "words": 1000,
      "guidance": "Politico: ~1000 words, policy-mechanics focus, timely; Hill and agency audience."
    },
    "Regional": {
      "words": 650,
      "guidance": "Regional / local daily: 500-800 words, direct regional relevance, local anecdotes, state-level calls to action; municipal voters and state legislators."
    },
    "Generic": {
      "words": 800,
      "guidance": "General-interest opinion desk: ~800 words, strong news hook, plain language, broad public audience."
    },
    "TechPolicyPress": {
      "words": 1500,
      "guidance": "Tech Policy Press (Perspective/Analysis): 1200-2000 words in 3-5 subheaded sections. Analytical and evidence-grounded with a clear argumentative throughline; sophisticated but clear (college-level register, precise policy vocabulary — do NOT dumb down, but keep sentences disciplined). Anchor in a specific, current policy development (named legislation, institution, or event) and draw out the broader governance/democratic stakes — concrete-first, not abstract theory. Sparing first person from a stated vantage; rhetorical questions and concrete hypotheticals used sparingly; cite verifiable sources. Audience: policymakers, technologists, researchers, and informed advocates at the tech-and-democracy intersection.",
      "readability": {
        "fkMax": 16,
        "maxSentWords": 40,
        "maxParaWords": 120
      },
      "style": {
        "audience": "persuade an informed policy audience — policymakers, technologists, researchers, and advocates at the tech-and-democracy intersection",
        "readingLevel": "Write for a college-educated policy audience — Flesch-Kincaid grade ~13 (no higher than 14). Achieve clarity through sentence discipline, NOT by simplifying vocabulary: keep the precise policy and technical terms your expert readers expect.",
        "sentenceMechanics": "average under ~24 words; no sentence over 40 words. Vary length; after a long sentence, a short one.",
        "paragraphMechanics": "at most ~120 words per paragraph.",
        "jargonGuidance": "Use the precise policy/technical vocabulary your expert audience expects; define only genuinely obscure terms. Do NOT flatten specialized terms into lay paraphrase.",
        "bodyFormat": "Organize the body into **3-5 sections with short Markdown `##` subheadings**; each section advances one part of the argument. Do NOT repeat the headline inside the body."
      }
    }
  }
}
